,title,url,Unnamed: 2
0,Trump joins 'Tucker' for first on-camera interview since COVID-19 diagnosis,https://www.youtube.com/watch?v=b8dGSyHnGF0,
1,Former NJ Gov. Chris Christie leaves hospital after COVID-19 treatment,https://www.youtube.com/watch?v=YLhaYubQpKc,
2,Dr. Oz breaks down most promising COVID-19 treatments,https://www.youtube.com/watch?v=vQ_mrOkZnbc,
3,White House: Trump has approved revised COVID-19 stimulus package,https://www.youtube.com/watch?v=j1_S0DZr3aE,
4,This is how US adversaries are exploiting the COVID-19 crisis,https://www.youtube.com/watch?v=ZjaGrDpldTg,
5,"Hannity: How China, WHO could have prevented the COVID-19 pandemic",https://www.youtube.com/watch?v=AqjHOXzf1Zs,
7,Trump valet tests positive for COVID-19,https://www.youtube.com/watch?v=AmqLB5pDj3Y,
8,Azar dismisses possibility of second shutdown despite record COVID-19 cases,https://www.youtube.com/watch?v=gB5-pbsrPlk,
9,Trump predicts COVID-19 vaccine by end of year despite FDA's pushback,https://www.youtube.com/watch?v=Tcb1ra05Eq4,
10,Hundreds of inmates released amid COVID-19 crisis,https://www.youtube.com/watch?v=h_9XIg3deRY,
11,Fake COVID-19 tests seized by border patrol,https://www.youtube.com/watch?v=wk42BCVErQw,
12,Why are some fully-recovered COVID-19 patients getting it again?,https://www.youtube.com/watch?v=lMAVBHDIeDA,
13,Military medical personnel deploy to Texas to aid in COVID-19 response,https://www.youtube.com/watch?v=F43UVTj-T54,
14,Italy's health care system remains inundated with COVID-19 cases,https://www.youtube.com/watch?v=W6ZaHOVMM-U,
15,Dr Fauci testifies before Senate on COVID-19 progress,https://www.youtube.com/watch?v=BcjoWhgBGZI,
16,Report: Trump knew in February COVID-19 was ‘deadly’,https://www.youtube.com/watch?v=kCtEhgYPmrw,
17,DHS research shows COVID-19 is vulnerable to these conditions,https://www.youtube.com/watch?v=KHJfZubEFkU,
18,Trump and Melania test positive for coronavirus,https://www.youtube.com/watch?v=NyqL6CY19g8,
19,Florida Gov DeSantis discusses state COVID-19 numbers,https://www.youtube.com/watch?v=ENifteplBpM,
20,Barrasso lays out what the next COVID-19 stimulus bill needs to contain,https://www.youtube.com/watch?v=cOM5sSLTHRI,
21,COVID-19 cases in military quadruple in less than a week,https://www.youtube.com/watch?v=-DGnSvuQ0K8,
22,Trump enlists private sector to expand COVID-19 testing,https://www.youtube.com/watch?v=qgUh2AOyW5M,
23,"Mark Meadows passionately defends admin's COVID-19 response, talks reelection",https://www.youtube.com/watch?v=lMTZRdCPA4U,
24,Cuomo releases COVID-19 'leadership' book as NYC re-enters lockdown,https://www.youtube.com/watch?v=G5tuci5i5g4,
25,How the COVID-19 pandemic is impacting the oil industry,https://www.youtube.com/watch?v=M1wYG45qrbs,
26,Dr. Oz predicts COVID-19 will circulate like seasonal flu,https://www.youtube.com/watch?v=ob9aMup5ASI,
27,North Korea continues to claim zero COVID-19 cases despite reports of death,https://www.youtube.com/watch?v=H_VgsLu-0Kc,
28,"New study details lifespan of coronavirus in air, on surfaces",https://www.youtube.com/watch?v=ebtpY4jZ9ds,
29,Scientists mull injecting adults with COVID-19 to speed up vaccine,https://www.youtube.com/watch?v=D6MaiwYFlfU,
30,Coronavirus cases are surging; Who's to blame? | FOX News Rundown,https://www.youtube.com/watch?v=u4DdR3riuy0,
31,Kellyanne Conway tests positive for COVID-19,https://www.youtube.com/watch?v=bKbcKfOFoAM,
32,Kayleigh McEnany tests positive for COVID-19,https://www.youtube.com/watch?v=veB_TxzMm5E,
33,Trump announces new fight against drug cartels exploiting COVID-19 pandemic,https://www.youtube.com/watch?v=99XYBOZHZW0,
34,Gutfeld: Cancel culture is like COVID-19,https://www.youtube.com/watch?v=R6kfOHmcdyQ,
35,Trey Gowdy demands China be held accountable for coronavirus,https://www.youtube.com/watch?v=e_kYDA7zNfg,
36,Sources: Coronavirus pandemic may have started in Chinese laboratory,https://www.youtube.com/watch?v=eT47ulzfOMo,
37,Hannity: The COVID-19 crisis brings out the best and worst in America,https://www.youtube.com/watch?v=VVEjkTByWak,
38,Gov. DeWine says Ohio estimated to have over 100K cases of coronavirus,https://www.youtube.com/watch?v=HnjvX8oLBdo,
39,Secretary Azar touts 'breakthrough' plasma treatment for COVID-19,https://www.youtube.com/watch?v=ah1cgUlYyXU,
40,Watch Gov. Andrew Cuomo call COVID-19 the 'European virus',https://www.youtube.com/watch?v=-EnNHsS99wk,
41,Ingraham: Government can't eliminate all health risks associated with COVID-19,https://www.youtube.com/watch?v=0uKpfJKD4Zw,
42,Biden delivers remarks following Trump's positive COVID-19 test,https://www.youtube.com/watch?v=GzcSGbFMvHo,
43,"Tucker: As US loses jobs to COVID-19 crisis, government issues new work visas",https://www.youtube.com/watch?v=vq5M31NhnV8,
44,"This jail released 1,300 inmates to prevent spread of COVID-19",https://www.youtube.com/watch?v=s7klbHPC0eQ,
45,"Tracking coronavirus cases, heat map updates | 3/30/2020",https://www.youtube.com/watch?v=tdxmR6G8oZ0,
46,Chris Christie tests positive for COVID-19,https://www.youtube.com/watch?v=eG9r7T-g_LY,
47,Trump passionately vows to investigate why initial COVID-19 info was hidden,https://www.youtube.com/watch?v=mhJiyhSTwo8,
48,Louisiana lawmaker dies at age 54 from COVID-19,https://www.youtube.com/watch?v=43u1x5lB5jE,
49,Ingraham: Civil liberties at risk in COVID-19 era,https://www.youtube.com/watch?v=wF3-4SkaSt4,
50,"Pelosi stresses need for ventilators, testing for COVID-19",https://www.youtube.com/watch?v=6-Y-piW7zNg,
51,FBI warns China against targeting COVID-19 research orgs,https://www.youtube.com/watch?v=8l0MEJcwQC8,
52,Trump meets with recovered COVID-19 patients,https://www.youtube.com/watch?v=e4P5l6TsFw0,
53,Trump accuses WHO is 'covering up' the spread of COVID-19,https://www.youtube.com/watch?v=Yod89-C9jcc,
54,Gutfeld on the media's response to Trump's COVID-19 diagnosis,https://www.youtube.com/watch?v=_-e_Cqypm9Y,
55,McConnell pushes liability protection in new COVID-19 relief package,https://www.youtube.com/watch?v=TazMTFB2UQ8,
56,White House responds to Trump's controversial comments on COVID-19,https://www.youtube.com/watch?v=3EE0iraUQA0,
57,Chris Wallace on the impact of Trump's COVID-19 diagnosis on the election,https://www.youtube.com/watch?v=akTQpnKd5BE,
58,South Carolina debate called off after Lindsey Graham refuses COVID-19 test,https://www.youtube.com/watch?v=HJBws_DMm5A,
59,McEnany: Pence is self-isolating after aide tests positive for COVID-19,https://www.youtube.com/watch?v=T9qFtDmbU2c,
60,McEnany 'feeling great' despite COVID-19 diagnosis,https://www.youtube.com/watch?v=ZOwB6yWsB8E,
61,Gutfeld on promising new treatments on the coronavirus,https://www.youtube.com/watch?v=Pevfw17JS6k,
62,Jared Kushner breaks down management of COVID-19 supply chain,https://www.youtube.com/watch?v=DQbb4LQeOUM,
63,Reporters dig into 'major mistakes' reported in Florida’s coronavirus data,https://www.youtube.com/watch?v=ta7g8BgKAXE,
64,Trump blasts COVID-19 oversight committee: 'A bunch of Trump haters',https://www.youtube.com/watch?v=CVoZlzBXA5g,
65,Trump considers executive action on COVID-19 relief,https://www.youtube.com/watch?v=HPkHeWrLqZU,
66,‘The Five’ slams media’s reaction to Trump’s COVID-19 response,https://www.youtube.com/watch?v=3UhVhNPwGpU,
67,"VP Pence, Second Lady test negative for COVID-19",https://www.youtube.com/watch?v=D9Z3mWoZiw8,
68,UK Prime Minister Boris Johnson out of ICU amid COVID-19 battle,https://www.youtube.com/watch?v=MHcsyJ1hpdw,
69,Barr says DOJ may side with citizens suing states over COVID-19 restrictions,https://www.youtube.com/watch?v=WztGYLJcxyc,
70,Hannity reacts to Trump testing positive for COVID-19 hours after interview,https://www.youtube.com/watch?v=PUcqYzsiHuc,
71,EXCLUSIVE: Pence on administration’s efforts to slow spread of COVID-19,https://www.youtube.com/watch?v=SNFd3-IptBI,
72,Ben Carson on coronavirus pandemic: We can't operate out of hysteria,https://www.youtube.com/watch?v=_FUiPbzoGSQ,
73,Sen. Elizabeth Warren's brother dies of COVID-19,https://www.youtube.com/watch?v=xR0vhbP7Xek,
74,White House partners with private sector to ramp up COVID-19 testing,https://www.youtube.com/watch?v=COFdZ-64M6M,
75,"Dr. Deborah Birx on the timeline for a COVID-19 vaccine, efforts to reopen America",https://www.youtube.com/watch?v=ZbBgNYZJWgY,
76,"Tracking coronavirus cases, heat map updates | 4/7/2020",https://www.youtube.com/watch?v=hIu9BqQva3I,
77,GOP slams Pelosi's COVID-19 relief bill as 'liberal wish list',https://www.youtube.com/watch?v=wRcSj_iJu8M,
78,"McConnell urges White House, Dems to restart COVID-19 relief talks",https://www.youtube.com/watch?v=VCCZ4XJAulo,
80,How will Trump's positive coronavirus results impact the campaign landscape?,https://www.youtube.com/watch?v=tVUejFOj3a8,
81,Cuban on COVID-19 small business loans: Best deal ever offered in history,https://www.youtube.com/watch?v=HAn0bK5O3ME,
82,Could we see a coronavirus vaccine by the end of 2020?,https://www.youtube.com/watch?v=XkUsC7oO_bc,
84,Adam Carolla's jailhouse wisdom on social distancing amid coronavirus crisis,https://www.youtube.com/watch?v=96VArmsfRq0,
85,Sen. Rand Paul tests positive for coronavirus,https://www.youtube.com/watch?v=2krpluWwCa0,
86,WHO declares coronavirus outbreak a pandemic,https://www.youtube.com/watch?v=d1eEWihvwpQ,
88,Biden accuses Trump of hiding COVID-19 to protect stock market,https://www.youtube.com/watch?v=d9fa_Ei9nHs,
89,When will a coronavirus vaccine be ready?,https://www.youtube.com/watch?v=mbzsRZ1gX1M,
91,Trump responds to questions on knowing about COVID-19 in February,https://www.youtube.com/watch?v=YnaL9nhsK40,
92,Rep Gohmert tests positive for coronavirus ahead of Texas visit with Trump,https://www.youtube.com/watch?v=s3Hb1OVlvNU,
93,Tucker: Coronavirus pandemic is a real fear,https://www.youtube.com/watch?v=lydWQoqDNp8,
94,Kayleigh McEnany speaks out for first time since testing positive for COVID-19,https://www.youtube.com/watch?v=EDbAVSZmRVc,
95,White House coronavirus task force member Peter Navarro on federal government's response to COVID-19,https://www.youtube.com/watch?v=Z5cG6m0fYXY,
96,Kellyanne Conway touts Trump's coronavirus response despite surging cases,https://www.youtube.com/watch?v=F1IjyMxkQh4,
97,Top White House officials in self-quarantine due to COVID-19,https://www.youtube.com/watch?v=M8HrDhvq1Kg,
98,Veterans are uniquely qualified to help during COVID-19 crisis: Goldberg,https://www.youtube.com/watch?v=Q5C2OPwAiSc,
99,Ingraham: The real COVID record,https://www.youtube.com/watch?v=alJDB2N3XfU,
100,Missouri becomes first state to sue China over coronavirus pandemic,https://www.youtube.com/watch?v=lp2czs3U8Qk,
101,Ari Fleischer: WHO deserves criticism over handling of COVID-19,https://www.youtube.com/watch?v=dYR8_yAyZZ4,
102,Here's what New Yorkers think about Trump's COVID-19 diagnosis,https://www.youtube.com/watch?v=wC27H4m4D0I,
103,Pompeo addresses China's lack of transparency in COVID-19 handling,https://www.youtube.com/watch?v=fPgTJfTHixA,
104,"Hamas, Israel agree to ceasefire amid COVID-19 spread",https://www.youtube.com/watch?v=N9twzQ3MJEc,
106,'Tucker Carlson Tonight' tries new rapid coronavirus test on air,https://www.youtube.com/watch?v=DbiCwYhZnGo,
107,Tom Homan says liberals are using coronavirus as an excuse to free detained illegal immigrants,https://www.youtube.com/watch?v=m92VpRcOG18,
108,FDA commissioner talks using unapproved drugs to combat COVID-19,https://www.youtube.com/watch?v=jk_jrlgvTdo,
109,Kayleigh McEnany defends Trump's COVID-19 executive orders,https://www.youtube.com/watch?v=hyoaq6qFR2M,
110,Biden claims Trump 'rooting for violence' to distract from COVID-19,https://www.youtube.com/watch?v=Ln9SmtV734o,
111,Trump vows COVID-19 vaccine doses for 'every American' by April 2021,https://www.youtube.com/watch?v=PXJk0NamXaA,
112,York reacts to Pompeo blasting China for suppressing coronavirus information,https://www.youtube.com/watch?v=LHrOoi8o6VA,
113,Senate Democrats block Republicans' COVID-19 relief bill,https://www.youtube.com/watch?v=RhqbxW6_aEY,
114,Tucker: Are coronavirus lockdowns working?,https://www.youtube.com/watch?v=rBLXdKB-PjI,
115,Trump displaying 'mild symptoms' after positive coronavirus test: White House,https://www.youtube.com/watch?v=hTiCKXdOQWY,
116,"'The Five' react to Trump, Melania testing positive for coronavirus",https://www.youtube.com/watch?v=k3szAFlhoHA,
117,Pence hits back at Gov. Cuomo's criticism of Trump admin's COVID-19 response,https://www.youtube.com/watch?v=UnTEGb3NDuk,
118,Symone Sanders pressed on whether Biden will take COVID-19 vaccine,https://www.youtube.com/watch?v=SibTCJU-xjY,
119,Steve Hilton: A turning point in the war against COVID-19,https://www.youtube.com/watch?v=PuTdNBn-C_U,
120,McCarthy blasts Pelosi for playing 'political games' with COVID-19 relief,https://www.youtube.com/watch?v=R1NAwgojJ8U,
122,Will efforts to combat spread of coronavirus threaten civil liberties?,https://www.youtube.com/watch?v=aHnjQQ49U7Q,
123,Fauci urges Trump to be flexible on timeline to lift COVID-19 restrictions,https://www.youtube.com/watch?v=d8S52yrR8Tk,
124,Gutfeld on Trump vs. the media during the COVID-19 pandemic,https://www.youtube.com/watch?v=lBeVHHrwd_k,
125,Quarantined coronavirus patient says family has been receiving death threats,https://www.youtube.com/watch?v=sunC9bSRCzQ,
127,Dr. Fauci says he's 'cautiously optimistic' regarding coronavirus vaccine,https://www.youtube.com/watch?v=DVRb4dm9Hqw,
128,Gutfeld: It's up to you and me to get us out of the COVID-19 mess,https://www.youtube.com/watch?v=0i1VTZwgtWM,
129,Scalise on Louisiana becoming the next possible epicenter for coronavirus,https://www.youtube.com/watch?v=iCz-flpshs4,
130,'The Five’ reacts to reports claiming China covered up coronavirus,https://www.youtube.com/watch?v=UYrPGuYUREk,
131,Tucker: Big Tech censors dissent over coronavirus lockdowns,https://www.youtube.com/watch?v=sPrbGU0Wyh4,
132,"Bill Gates on his 2015 'virus' warning, efforts to fight coronavirus pandemic",https://www.youtube.com/watch?v=jXHikITwlng,
133,Beijing launches campaign to punish coronavirus patients,https://www.youtube.com/watch?v=mFv8alFqNls,
134,Boris Johnson moved to ICU as COVID-19 symptoms worsen,https://www.youtube.com/watch?v=haekXaf7ePc,
135,Judge Jeanine: Media hit the panic button over coronavirus,https://www.youtube.com/watch?v=JNeYRwChLfE,
136,House GOP announce discharge petition to force vote on COVID-19 bill,https://www.youtube.com/watch?v=rjNP1_X-vps,
137,Tucker: Are coronavirus lockdowns working?,https://www.youtube.com/watch?v=MuuA0azQRGQ,
138,Hope Hicks tests positive for coronavirus following travel with Trump: Report,https://www.youtube.com/watch?v=RWvaYXtzM-w,
140,USNORTHCOM steps up to help a nation in need during COVID-19,https://www.youtube.com/watch?v=34OR6HEyza4,
141,Dr. Oz's message for millennials ignoring coronavirus warnings,https://www.youtube.com/watch?v=5XzPkTd0eos,
142,'The Five' slam Biden's COVID-19 policy calling it 'too black and white',https://www.youtube.com/watch?v=2zc9a1vkrZk,
143,Hannity: Media using coronavirus coverage as political weapon,https://www.youtube.com/watch?v=-EQy2eawqS0,
144,Kentucky Governor delivers remarks on COVID-19 response,https://www.youtube.com/watch?v=1rAaXu5344k,
145,"Tom Hanks, Rita Wilson released from hospital after COVID-19 treatment: Report",https://www.youtube.com/watch?v=zVTgcIJFE3I,
146,White House warns against buying COVID-19 antibody tests online,https://www.youtube.com/watch?v=brwWYdtqVSM,
147,NSA Robert O'Brien tests positive for coronavirus,https://www.youtube.com/watch?v=h94cemSStUA,
148,Coronavirus Task Force provides updates on nationwide cases,https://www.youtube.com/watch?v=QDpMnmf9ElM,
149,Sen. Ernst proposes directing unused 2020 campaign funds to COVID-19 fight,https://www.youtube.com/watch?v=l1cbb_GOeGk,
150,'Tucker Carlson Tonight' tries new rapid coronavirus test on air,https://www.youtube.com/watch?v=DbiCwYhZnGo,
151,Judge Jeanine: Media hit the panic button over coronavirus,https://www.youtube.com/watch?v=JNeYRwChLfE,
152,"Drs. Saphier, Makary answer viewers' coronavirus questions",https://www.youtube.com/watch?v=toy4lVq1hww,
153,Trump speaks at Coronavirus Task Force briefing | 7/21/20,https://www.youtube.com/watch?v=44-TzNRrwZU,
156,Trump to temporarily suspend immigration as coronavirus precaution,https://www.youtube.com/watch?v=eR0eXk2uulc,
158,Gov. Noem explains how South Dakota kept COVID cases low without locking down,https://www.youtube.com/watch?v=wlUkKPcwc0k,
159,Beijing launches campaign to punish coronavirus patients,https://www.youtube.com/watch?v=mFv8alFqNls,
160,EXCLUSIVE: Trump says he would 'absolutely' take COVID vaccine during interview,https://www.youtube.com/watch?v=kzhh_QqHVXU,
163,Tucker shreds CNN’s Cuomo for phony coronavirus ‘reemergence video’,https://www.youtube.com/watch?v=J7oLjAAIsKg,
164,Trump displaying 'mild symptoms' after positive coronavirus test: White House,https://www.youtube.com/watch?v=hTiCKXdOQWY,
166,Will efforts to combat spread of coronavirus threaten civil liberties?,https://www.youtube.com/watch?v=aHnjQQ49U7Q,
167,Tucker: Coronavirus pandemic is a real fear,https://www.youtube.com/watch?v=lydWQoqDNp8,
168,Dr. Phil's grim warning about mental health risks amid coronavirus,https://www.youtube.com/watch?v=5GLwsH8EwgA,
169,Missouri becomes first state to sue China over coronavirus pandemic,https://www.youtube.com/watch?v=lp2czs3U8Qk,
170,Gutfeld on limiting coronavirus lawsuits,https://www.youtube.com/watch?v=felnRnj_zZ8,
171,Media overreacts to Trump's potential coronavirus exposure,https://www.youtube.com/watch?v=r5LSeokJfXE,
173,Trump declares National Emergency over coronavirus,https://www.youtube.com/watch?v=G6HbxcCb-7g,
174,Criminals continue to benefit from coronavirus lockdowns,https://www.youtube.com/watch?v=oPnkIdJCWkQ,
175,Tucker: Now we see that COVID lockdowns aren't the only solution,https://www.youtube.com/watch?v=QIf2audbX0Q,
176,Dave Portnoy unleashes scathing coronavirus rant on 'Tucker Carlson Tonight',https://www.youtube.com/watch?v=jJDGjZ5nefE,
177,Judge Jeanine presses Dr. Birx on how coronavirus deaths are being recorded,https://www.youtube.com/watch?v=4l_jUZ515Zg,
178,Dr. Fauci testifies before Senate on coronavirus response,https://www.youtube.com/watch?v=J0Kavkyn46U,
179,Dr. Fauci says he's 'cautiously optimistic' regarding coronavirus vaccine,https://www.youtube.com/watch?v=DVRb4dm9Hqw,
180,Joint Chiefs of Staff quarantine after Coast Guard official tests COVID positive,https://www.youtube.com/watch?v=q8muaOxHn3o,
181,Gov. Noem explains how South Dakota kept COVID cases low without locking down,https://www.youtube.com/watch?v=wlUkKPcwc0k,
182,Ingraham: Persistence not politics during the coronavirus crisis,https://www.youtube.com/watch?v=rLezK6SQNNk,
183,EU considers coronavirus travel ban from US as Europe begins to reopen,https://www.youtube.com/watch?v=E2QhpCL9qmA,
185,Tucker shreds CNN’s Cuomo for phony coronavirus ‘reemergence video’,https://www.youtube.com/watch?v=J7oLjAAIsKg,
187,Hannity: We're witnessing the beginning of the end of coronavirus lockdowns,https://www.youtube.com/watch?v=A3tTItfslbM,
188,Dave Portnoy unleashes scathing coronavirus rant on 'Tucker Carlson Tonight',https://www.youtube.com/watch?v=jJDGjZ5nefE,
190,EXCLUSIVE: Trump says he would 'absolutely' take COVID vaccine during interview,https://www.youtube.com/watch?v=kzhh_QqHVXU,
191,Tucker: Why would America's media take China's side amid coronavirus pandemic?,https://www.youtube.com/watch?v=5W9vjsFQUUU,
192,Tucker: Coronavirus response is being driven by politics,https://www.youtube.com/watch?v=uQS-Er4amRA,
193,Steve Hilton on the long-term consequences of coronavirus,https://www.youtube.com/watch?v=3ebpS88BAwA,
194,CDC analysis shows coronavirus poses serious risk for young people,https://www.youtube.com/watch?v=ocLK8aEXR98,
195,Trump to temporarily suspend immigration as coronavirus precaution,https://www.youtube.com/watch?v=eR0eXk2uulc,
196,Tucker: Experts can't predict when coronavirus pandemic will end,https://www.youtube.com/watch?v=VdK77bhAwO0,
197,Tucker: Now we see that COVID lockdowns aren't the only solution,https://www.youtube.com/watch?v=QIf2audbX0Q,
198,"Drs. Saphier, Makary answer viewers' coronavirus questions",https://www.youtube.com/watch?v=toy4lVq1hww,
199,Judge Jeanine presses Dr. Birx on how coronavirus deaths are being recorded,https://www.youtube.com/watch?v=4l_jUZ515Zg,
200,Media coverage of Gov. Cuomo's coronavirus response shocks 'The Five',https://www.youtube.com/watch?v=VSry8qlfjkk,
201,Dr. Fauci testifies before Senate on coronavirus response,https://www.youtube.com/watch?v=J0Kavkyn46U,
203,Trump receives a Coronavirus briefing from officials at the CDC,https://www.youtube.com/watch?v=-uc_ZdJ-kAo,
204,"Pelosi, House Dems discuss US response to coronavirus",https://www.youtube.com/watch?v=EOW29FrtPnM,
206,Clinton’s outrageous comments on coronavirus leave ‘The Five’ speechless,https://www.youtube.com/watch?v=KF4xRnxLLlc,
208,Tucker: We must remain calm but not complacent about the coronavirus,https://www.youtube.com/watch?v=EbyPW8lJX2E,
211,Health officials fear protests will cause coronavirus cases to surge,https://www.youtube.com/watch?v=gdH8UX5eAY0,
214,Ingraham: Lessons learned from coronavirus crisis,https://www.youtube.com/watch?v=Yu9jpEmzymU,
215,Trump declares National Emergency over coronavirus,https://www.youtube.com/watch?v=G6HbxcCb-7g,
216,Hannity: The cure cannot be worse than the coronavirus crisis itself,https://www.youtube.com/watch?v=rqExfCNvDa0,
218,Coronavirus lawsuits flooding courts; who will win? | FOX News Rundown,https://www.youtube.com/watch?v=3KKP18Wkp68,
220,"Trump, Coronavirus Task Force hold White House press briefing | 4/21/20",https://www.youtube.com/watch?v=vX2KxYmJfjE,
221,Johnson & Johnson exec hopeful on possible coronavirus vaccine,https://www.youtube.com/watch?v=HlFOEyyGFOo,
223,Kamala Harris to discuss Trump's response to coronavirus,https://www.youtube.com/watch?v=Og8PLfNwNOw,
224,Pence holds Coronavirus Task Force briefing,https://www.youtube.com/watch?v=tkNkIMf8raI,
226,Barstool Sports founder on making the most of coronavirus quarantine,https://www.youtube.com/watch?v=-r6mUnerPtc,
227,Bret Baier shares updates on explosive report about coronavirus origins,https://www.youtube.com/watch?v=X5Dued_2ulY,
228,Dr. Fauci on coronavirus in the US: It's going to get worse,https://www.youtube.com/watch?v=05_0zMCTXe0,
229,Herman Cain dies after contracting coronavirus,https://www.youtube.com/watch?v=faYwXee7zdQ,
230,Dems call to delay SCOTUS hearings after Sen Lee tests positive for COVID-19,https://www.youtube.com/watch?v=PgOOjGuP9fk,
233,Trump unveils coronavirus therapeutic 'breakthrough',https://www.youtube.com/watch?v=ZpTNeMSTv7Q,
235,Ohio Gov. on decision not to postpone Tuesday's primary amid coronavirus,https://www.youtube.com/watch?v=kUZgGQwYL7c,
236,Tucker: Elites don't want you to question their coronavirus policies,https://www.youtube.com/watch?v=JdF-p97NdaY,
237,Trump joins Coronavirus Task Force for White House breifing | 4/23/20,https://www.youtube.com/watch?v=7DEiXWZrEak,
239,More stimulus payments? Scalia weighs in as coronavirus cases surge,https://www.youtube.com/watch?v=ImZb3pywITc,
240,Rep. Dan Crenshaw: China lied about coronavirus and Americans should sue,https://www.youtube.com/watch?v=y-DXEogwVXo,
241,Pence staffer who tested positive for coronavirus 'doing well': Marc Short,https://www.youtube.com/watch?v=DHBFGzy3GPw,
242,'The Five' tears into Dems for attempting to delay coronavirus measures,https://www.youtube.com/watch?v=ZTw3z8WQzDY,
243,Bipartisan congressional group unveils COVID relief plan,https://www.youtube.com/watch?v=X5ndcAPIm_E,
245,Coronavirus controversy: Chinese official suggests US is responsible,https://www.youtube.com/watch?v=hZftihVyq9E,
247,"Biden says he would have handled COVID better, Karl Rove debunks that claim",https://www.youtube.com/watch?v=JEN0Oj9V9Fg,
249,Mike Pence weighs in on coronavirus vaccine timeline,https://www.youtube.com/watch?v=8TbElQOhvPs,
250,Trump says he no longer has coronavirus and is 'immune',https://www.youtube.com/watch?v=4l8y_TLPCTg,
251,Kellyanne Conway teases possible 'phase four' of coronavirus relief bill,https://www.youtube.com/watch?v=m43o6VCWlrs,
252,Biden to discuss developing a coronavirus vaccine,https://www.youtube.com/watch?v=IwpM0n8Hspg,
253,Gutfeld: Coronavirus and the war of perspectives,https://www.youtube.com/watch?v=XI7cIQ-mY3E,
254,Brazilian President Bolsonaro tests positive for coronavirus,https://www.youtube.com/watch?v=zi8EQioe21o,
255,Price of pandemic: DC restaurant owner on financial cost of coronavirus protective measures,https://www.youtube.com/watch?v=ZOfdGTvBs8A,
257,Study shows hydroxychloroquine cut death rates in some coronavirus patients,https://www.youtube.com/watch?v=_PdVFslBmWw,
258,"Trump, Coronavirus Task Force hold White House press briefing",https://www.youtube.com/watch?v=dmpbWUt338I,
260,Matthew McConaughey warns against partisan division over coronavirus response,https://www.youtube.com/watch?v=ycl5GQTsw1s,
262,Prince Charles tests positive for coronavirus,https://www.youtube.com/watch?v=jR0EotcwNY8,
263,How are big cities and large states handling the coronavirus outbreak?,https://www.youtube.com/watch?v=LmNOVFozyjo,
264,Trump speaks talks coronavirus with governors at FEMA headquarters,https://www.youtube.com/watch?v=3gjPFelN1vY,
265,Ingraham: Sounding the alarm on coronavirus,https://www.youtube.com/watch?v=n4Lv37P3vQ0,
271,Collins blasts Schiff for undermining Trump's handling of coronavirus,https://www.youtube.com/watch?v=QYbwH3790i0,
