,title,url,Unnamed: 2
0,Chinese virologist posts report claiming COVID-19 was made in Wuhan lab | New York Post,https://www.youtube.com/watch?v=ny-zkRZeW_w,
1,"Long Island mom describes coronavirus symptoms, testing struggles | New York Post",https://www.youtube.com/watch?v=h6z7nrcjv0A,
2,Astrologer predicts coronavirus second wave is coming | New York Post,https://www.youtube.com/watch?v=2xPqIyaXJJo,
3,Dr. Fauci warns that Trump’s COVID-19 recovery could soon go into ‘reversal’ | New York Post,https://www.youtube.com/watch?v=yslwUwP3rRM,
4,Man dies from coronavirus after calling it a political ploy | New York Post,https://www.youtube.com/watch?v=0dXzfIuZmsg,
5,Mom who chronicled COVID-19 battle says virus may have given her glaucoma | New York Post,https://www.youtube.com/watch?v=W4EaUTCxjc4,
6,Heartbroken nurse reveals how COVID-19 patients say goodbye to family | New York Post,https://www.youtube.com/watch?v=nKjR1SvE9kY,
7,Bill Gates becomes top target of bogus coronavirus conspiracy theories | New York Post,https://www.youtube.com/watch?v=wnvlZw03bRw,
8,"Stock futures, oil prices plunge after Trump tests positive for COVID-19 | New York Post",https://www.youtube.com/watch?v=wHGy62LuJCo,
10,Stressed mortician describes coronavirus overflow: ‘It is dark right now’ | New York Post,https://www.youtube.com/watch?v=Uh1SFHAmVGg,
11,Fauci urges Americans to wear goggles for added COVID-19 protection | New York Post,https://www.youtube.com/watch?v=RCPsqTS3B_Y,
12,Gov. Cuomo outlines COVID-19 requirements for NYC schools to reopen in the fall | New York Post,https://www.youtube.com/watch?v=Vk_wPvpDuxw,
13,"Man who called coronavirus ‘fake crisis’ gets infected, issues warning | New York Post",https://www.youtube.com/watch?v=BGrA1FQfsUM,
14,Everything we know about the Wuhan lab that may have unleashed coronavirus | New York Post,https://www.youtube.com/watch?v=5qO3MrhXM2A,
15,Pfizer coronavirus vaccine could be ready for emergency use by this fall | New York Post,https://www.youtube.com/watch?v=AV8udwg2Vzk,
16,Coronavirus may have been spreading in China since August 2019 | New York Post,https://www.youtube.com/watch?v=cckJXGd3tB0,
17,White House press secretary Kayleigh McEnany tests positive for COVID-19 | New York Post,https://www.youtube.com/watch?v=m85dPsV1qXs,
18,Coronavirus conspiracy theories don’t stop at Bill Gates and 5G | New York Post,https://www.youtube.com/watch?v=igZvO8n5hCc,
19,Joe Biden wishes Trumps a ‘swift recovery’ after COVID-19 diagnoses | New York Post,https://www.youtube.com/watch?v=19SMVepfJeE,
20,Dr. Mike says crucial COVID-19 antibody tests can't confirm immunity | New York Post,https://www.youtube.com/watch?v=s37NcZek9Tw,
21,"Tommy DeVito, original Four Seasons member, dead at 92 from COVID-19 | New York Post",https://www.youtube.com/watch?v=iTqPd0NxQwE,
23,Coronavirus survivor shares shocking body transformation photo in hospital | New York Post,https://www.youtube.com/watch?v=xObV8aR-NfY,
24,"Elon Musk says he won’t take coronavirus vaccine, calls Bill Gates a ‘knucklehead’ | New York Post",https://www.youtube.com/watch?v=2lPkvteqKig,
25,How to safely order takeout and delivery food during coronavirus lockdown | New York Post,https://www.youtube.com/watch?v=vhGj0a3ijJQ,
26,Harvard researchers figure out why coronavirus causes loss of smell | New York Post,https://www.youtube.com/watch?v=gLhPA75b90k,
27,Can the coronavirus be spread through farts? | New York Post,https://www.youtube.com/watch?v=WMyAxivxzUk,
28,"Fauci and Rand Paul clash over Cuomo, NY handling of COVID-19 | New York Post",https://www.youtube.com/watch?v=DjCUlRk7cfQ,
29,Long Island mom with coronavirus reveals how to prepare for ‘quarantine prison’ | New York Post,https://www.youtube.com/watch?v=2hdxNUCAQL0,
30,Harvard researchers figure out why coronavirus causes loss of smell | New York Post,https://www.youtube.com/watch?v=gLhPA75b90k,
31,"Over 20,000 people have died from coronavirus in NYC | New York Post",https://www.youtube.com/watch?v=E02fTKuSdZ8,
32,NYC Orthodox community holds large protest over new coronavirus restrictions | New York Post,https://www.youtube.com/watch?v=X5remfcNflY,
33,Millennials are moving back in with parents during the coronavirus quarantine | New York Post,https://www.youtube.com/watch?v=Tu20R8TdG0U,
34,Everything we know about the Wuhan lab that may have unleashed coronavirus | New York Post,https://www.youtube.com/watch?v=5qO3MrhXM2A,
35,'Ark Two' nuclear fallout shelter seemed crazy 'til coronavirus | New York Post,https://www.youtube.com/watch?v=xkKOBRqggXA,
37,Recovered coronavirus patients in China test positive weeks later | New York Post,https://www.youtube.com/watch?v=FpoqOYJWMKM,
38,"China seizes control of PPE factories, sparking fear of another coronavirus wave | New York Post",https://www.youtube.com/watch?v=Mb-0mIdQfsw,
41,Creepy disinfectant tunnel and more ways China tries to beat Coronavirus | New York Post,https://www.youtube.com/watch?v=PAKFrXC2boo,
42,Tips on how to not destroy your relationship while in quarantine for coronavirus | New York Post,https://www.youtube.com/watch?v=ysDdWVu6c5A,
43,Face shields given to newborn babies to fend off coronavirus | New York Post,https://www.youtube.com/watch?v=G3JJ9a3aW68,
44,ER Doctor pleads people with minor symptoms to avoid the ER during Coronavirus | New York Post,https://www.youtube.com/watch?v=dddyl-PhMLk,
46,Germ warfare researchers design ‘game-changer’ coronavirus test | New York Post,https://www.youtube.com/watch?v=moSk7GMTkGs,
49,Long Island mom still has questions as coronavirus isolation ends | New York Post,https://www.youtube.com/watch?v=z1k_bfuQJmo,
51,"NYC health officials advise kinky Zoom parties, masks during sex amid COVID-19 | New York Post",https://www.youtube.com/watch?v=h7oDmM0WnZs,
52,World leaders react to Trump’s coronavirus diagnosis | New York Post,https://www.youtube.com/watch?v=ts7F_k2UY6w,
53,Trump signs coronavirus bill reviving fund for small-business loans | New York Post,https://www.youtube.com/watch?v=11rsw1JmBA8,
56,How to survive ‘scary’ isolation during the coronavirus quarantine | New York Post,https://www.youtube.com/watch?v=FAOhrhZlJI0,
59,Streets of San Francisco are deserted amid coronavirus lockdown | New York Post,https://www.youtube.com/watch?v=atYkbk3iNbY,
62,President Trump: FDA is testing potential coronavirus treatments | New York Post,https://www.youtube.com/watch?v=gs5g9INIrdE,
63,Dr. Fauci warns coronavirus vaccine may not lead to herd immunity in US | New York Post,https://www.youtube.com/watch?v=MCpEv2YlFEs,
64,Streets of Milan are eerily empty amidst coronavirus lockdown | New York Post,https://www.youtube.com/watch?v=84x3gOK141E,
65,Wuhan suddenly increases coronavirus death toll by 50 percent | New York Post,https://www.youtube.com/watch?v=gF6vJI3dhdU,
66,House hearing on coronavirus response with testimony from Dr. Fauci.,https://www.youtube.com/watch?v=_C02wj9-duk,
69,"Gov. Cuomo talks coronavirus strategy, ‘cynical’ New Yorkers on ‘The Daily Show’ | New York Post",https://www.youtube.com/watch?v=LqXXMiYfq30,
70,The hilarious grocery store items people are NOT buying during coronavirus pandemic | New York Post,https://www.youtube.com/watch?v=zC0C8fadczw,
75,New coronavirus mutation causes outbreaks to spread more quickly | New York Post,https://www.youtube.com/watch?v=2X19MBtOM1w,
76,Tip twice as much during coronavirus hospitality expert says | New York Post,https://www.youtube.com/watch?v=UAC4IHo31gs,
77,Monkey gangs are taking over Thailand amid coronavirus | New York Post,https://www.youtube.com/watch?v=VDwAgWnmEOM,
79,Coronavirus 'coffin house' in Hong Kong is a prison for this man | New York Post,https://www.youtube.com/watch?v=mspYpBdRMuM,
82,Cuomo gives update on coronavirus response,https://www.youtube.com/watch?v=8_5C1-DZh5g,
83,White House update on coronavirus response,https://www.youtube.com/watch?v=RCfEUyr4Vik,
90,White House Coronavirus Task Force Briefing Live,https://www.youtube.com/watch?v=hXN3-17pGjk,
92,"Mayor de Blasio briefing on coronavirus response - April 15, 2020",https://www.youtube.com/watch?v=oQk5Kf8BuGY,
93,De Blasio briefing on coronavirus response,https://www.youtube.com/watch?v=8M9dYm7XoTE,
94,Cuomo gives update on coronavirus response,https://www.youtube.com/watch?v=Vp8aCgYrSqk,
95,Cuomo: Coronavirus density control measures slow spread in NY | New York Post,https://www.youtube.com/watch?v=9locUDtW5kk,
96,De Blasio briefing on coronavirus response,https://www.youtube.com/watch?v=JOE7Iecm_4E,
97,Banks are taking coronavirus stimulus checks for overdrawn accounts | New York Post,https://www.youtube.com/watch?v=3EsjrnKqSUQ,
98,"Cuomo gives update on coronavirus response - April 14, 2020",https://www.youtube.com/watch?v=wRLx9uNelUE,
99,Joe Biden has given ‘counsel’ to Michigan Gov. Whitmer amid coronavirus | New York Post,https://www.youtube.com/watch?v=ROtY2PH1x40,
100,Chris Cuomo gives coronavirus update during brother's presser | New York Post,https://www.youtube.com/watch?v=GzXtaF3W0ls,
101,Trump declares national emergency over coronavirus | New York Post,https://www.youtube.com/watch?v=129P5kEZV1M,
105,Governor Andrew Cuomo addresses New York City's confirmed coronavirus case | New York Post,https://www.youtube.com/watch?v=zrokxt-Amd0,
106,Dr. Fauci urges caution about relying on coronavirus antibody tests | New York Post,https://www.youtube.com/watch?v=Xc06BglzqTA,
109,Chinese Coronavirus Transforms Wuhan Into Eerie Wasteland | New York Post,https://www.youtube.com/watch?v=wZoyeywOHFk,
111,"Cuomo gives update on coronavirus response - April 17, 2020",https://www.youtube.com/watch?v=1WiMLvWAfuc,
112,VP Pence leads the Coronavirus Task Force during a briefing from the White House.,https://www.youtube.com/watch?v=FQ94duLv478,
116,Super Bowl champ Laurent Duvernay-Tardif battling coronavirus as a doctor | New York Post,https://www.youtube.com/watch?v=LCGVmNXRWSA,
118,"Cuomo gives update on coronavirus response - April 9, 2010",https://www.youtube.com/watch?v=O6QOa9jXGn4,
119,"Cuomo gives update on coronavirus response - April 13, 2020",https://www.youtube.com/watch?v=_axq00VZ3ZI,
